{
  "$schema": "./STATE.schema.json",
  "schema_version": 1,
  "project_name": "AutoDev",
  "project_status": "COMPLETE",
  "quality_mode": "HARDENING",
  "phase": "CHECKPOINT",
  "last_outcome": "PASS",
  "current_milestone": "M11-V4-RELEASE-GATE",
  "current_task_id": null,
  "last_good_commit": "bbf3005",
  "agent_calls": 0,
  "rework_count": 0,
  "blocker": null,
  "next_action": null,
  "next_owner": "NONE",
  "updated_at": "2026-08-30T04:42:35+08:00"
}
